{
  "schema_version": "unirouter.endpoint-profile-manifest.v1",
  "profile_id": "unirouter.anthropic.messages.text-tools.v3",
  "profile_version": "1.0.0",
  "provider": "anthropic",
  "runtime_state": "local_contract_only",
  "conformance_level": "fixture_verified",
  "network_verified": false,
  "descriptor": {
    "contract_version": "unirouter.endpoint-protocol.v1",
    "profile_id": "unirouter.anthropic.messages.text-tools.v3",
    "profile_version": "1.0.0",
    "provider": "anthropic",
    "endpoint_kind": "messages",
    "downstream_endpoint": "/v1/messages",
    "upstream_endpoint": "/v1/messages",
    "authentication": "x-api-key+anthropic-version",
    "runtime_state": "local_contract_only",
    "provider_finality": "terminal_message_or_message_stop_with_provider_usage",
    "customer_charge_state": "provider_observed_not_customer_chargeable",
    "supported_modalities": [
      "text"
    ],
    "observed_unit_classes": [
      "input_tokens",
      "cache_write_tokens",
      "cache_read_tokens",
      "output_tokens"
    ],
    "unsupported_semantics": [
      "anthropic_beta_features",
      "cache_control",
      "citations_or_documents",
      "extended_or_adaptive_thinking",
      "multimodal_content",
      "server_tools",
      "streaming_client_tools",
      "structured_output"
    ]
  },
  "fixtures": [
    {
      "fixture_id": "anthropic-messages-text-tools.v3",
      "path": "fixtures/anthropic-messages-text-tools.v3.json",
      "sha256": "sha256:9f66927977c3390c07118f2d61c6dfc3fb2d931c620853db23825fb0ab083617"
    }
  ]
}
